{
  "step1": {
    "title": "Step1 契約基線",
    "status": "COMPLETED",
    "artifacts": [
      "docs/plans/2026-03-01-v2.1.0-guide-parity-gate-plan.md",
      "docs/audits/2026-03-01-v2.1.0-guide-parity-gate-audit.md"
    ]
  },
  "step2": {
    "title": "Step2 實作與執行",
    "status": "UNVERIFIED",
    "run_ref": "N/A (step2-pending)",
    "artifacts": []
  },
  "step3": {
    "title": "Step3 資產保存",
    "status": "N/A",
    "artifacts": []
  },
  "step4": {
    "title": "Step4 結案交付",
    "status": "N/A",
    "artifacts": []
  }
}
